Title,Title_URL
"Sales Training: Practical Sales Techniques
<strong>Sales</strong> Hacking: Essential <strong>sales</strong> skills, <strong>sales</strong> strategies and <strong>sales</strong> techniques to sell just about anything!Rating: 4.6 out of 529360 reviews2.5 total hours39 lecturesAll LevelsCurrent price: ₹499Original price: ₹2,999",https://www.udemy.com/course/master-successful-selling/
"B2B Sales Masterclass: People-Focused Selling
Close deals using world-class discovery, demos, follow-up, and objection handling WITHOUT any shady or pushy tactics.Rating: 4.6 out of 55497 reviews3.5 total hours47 lecturesAll LevelsCurrent price: ₹499Original price: ₹3,099",https://www.udemy.com/course/b2b-sales-masterclass-people-focused-selling/
"How to Sell Anything to Anyone
Ethically Proven Persuasion Techniques, <strong>Sales</strong> Systems, Effective Negotiations & Pitches, All Backed By Years of ScienceRating: 4.6 out of 51645 reviews9.5 total hours46 lecturesAll LevelsCurrent price: ₹549Original price: ₹3,299",https://www.udemy.com/course/close-more-sales-young-pros/
"Sales Skills: 10 Sales Training Courses In 1
Develop Extraordinary <strong>Sales</strong> Skills With The Ultimate <strong>Sales</strong> Training (Taught By 5 Top <strong>Sales</strong> Experts)Rating: 4.3 out of 51530 reviews11 total hours166 lecturesAll LevelsCurrent price: ₹499Original price: ₹2,699",https://www.udemy.com/course/learn-sales-skills/
"Business Development & B2B Sales for Startups- Sales Valley
The Complete Startup Playbook for Business Development & B2B <strong>Sales</strong> to learn Lead Generation, Pitching, & Closing Deals.Rating: 4.5 out of 57508 reviews6 total hours36 lecturesAll LevelsCurrent price: ₹499Original price: ₹2,899",https://www.udemy.com/course/businessdevelopment-b2b-sales-for-startups-sales-valley/
"The Complete Sales MBA: 10 Sales Skills Courses in 1
Accredit Yourself With the <strong>Sales</strong> Skills MBA - All There is to Know on Ethical <strong>Sales</strong> (Scripts, Examples, Pitchdecks inc.)Rating: 4.3 out of 5282 reviews15 total hours183 lecturesAll LevelsCurrent price: ₹549Original price: ₹3,299",https://www.udemy.com/course/the-buying-code-stefan-devito-sales-skills-digital-marketing-strategy/
"Sales: First 90 Days as a New Sales Rep
Rating: 0.0 out of 50 reviews5 total hours108 lecturesAll LevelsCurrent price: ₹499Original price: ₹1,799",https://www.udemy.com/course/sales-first-90-days-as-a-new-sales-rep/
"Sales Training: Become A Sales Superstar
Develop Advanced <strong>Sales</strong> Skills To Sell Anything Like A Champ (Taught By A World-class Salesman)Rating: 4.9 out of 5348 reviews2 total hours35 lecturesAll LevelsCurrent price: ₹549Original price: ₹2,299",https://www.udemy.com/course/mastering-sales-how-to-hold-a-high-price/
"Sales Skills: A Sales Course on Influence and Persuasion
Mastering Persuasion, Influence, and <strong>Sales</strong>Rating: 4.8 out of 5107 reviews2 total hours24 lecturesAll LevelsCurrent price: ₹499Original price: ₹1,799",https://www.udemy.com/course/salesskills/
"Sales 101: How to Sell Anything (49 Amazing Sales Tips)®
Learn how to sell a product, a service or yourself, so you can get customers, a job, a raise or a promotion!Rating: 4.9 out of 5640 reviews2 total hours53 lecturesAll LevelsCurrent price: ₹549Original price: ₹2,999",https://www.udemy.com/course/sales-101-how-to-sell-anything-49-amazing-sales-tips/
"Sales Skills Training: Consultative Selling Master Class
<strong>Sales</strong> Training - Professional B2B Selling Skills for Consultants, Entrepreneurs and all Who Bring in the Business!Rating: 4.7 out of 54032 reviews6 total hours55 lecturesAll LevelsCurrent price: ₹499Original price: ₹2,699",https://www.udemy.com/course/sales-skills-consultative-selling-master-class/
"The Complete Sales Skills Master Class - Sales Marketing B2B
Master <strong>Sales</strong> Skills, Marketing Strategy, B2B <strong>Sales</strong>, Business Development, Lead Generation Using Top Social SkillsRating: 4.2 out of 5881 reviews30.5 total hours588 lecturesAll LevelsCurrent price: ₹499Original price: ₹2,499",https://www.udemy.com/course/the-complete-sales-skills-master-class-sales-marketing-b2b/
"Sales Skills & Negotiation Skills - Selling Masterclass
Learn How To Sell - Step By Step Guide To Self Development As A <strong>Sales</strong> Consultant - Structured Training For BeginnersRating: 4.5 out of 52053 reviews12 total hours291 lecturesBeginnerCurrent price: ₹499Original price: ₹2,699",https://www.udemy.com/course/sales-and-negotiation-skills-business-development-masterclass/
"Business Development & B2B Sales Masterclass
Business Development | Marketing | <strong>Sales</strong> | B2B <strong>Sales</strong> | Lead Generation | Business Development Executive | ProspectingRating: 4.6 out of 5240 reviews6 total hours56 lecturesAll LevelsCurrent price: ₹549Original price: ₹3,299",https://www.udemy.com/course/business-development-b2b/
"Sales Machine: The Sales Training B2B Master Course
Learn <strong>Sales</strong> Strategies & <strong>Sales</strong> Techniques to Sell ANYTHING for Entrepreneurs, Startup, B2B <strong>Sales</strong>, & Business DevelopmentRating: 4.5 out of 54486 reviews2.5 total hours25 lecturesAll LevelsCurrent price: ₹549Original price: ₹2,499",https://www.udemy.com/course/sales-machine-sales-training/
"How To Close Deals Over The Phone
Be the TOP PRODUCER on your <strong>sales</strong> team and get the COMMISSION $$$ you deserve!Rating: 4.7 out of 5252 reviews3 total hours15 lecturesAll LevelsCurrent price: ₹499Original price: ₹1,499",https://www.udemy.com/course/how-to-close-deals-over-the-phone/
"Digital Marketing Strategy - Profitable Sales Funnel Mastery
Learn to build a profitable <strong>sales</strong> funnel through captivating free offers, <strong>sales</strong> pages and email marketing sequences.Rating: 4.7 out of 5962 reviews12 total hours70 lecturesAll LevelsCurrent price: ₹499Original price: ₹3,099",https://www.udemy.com/course/profitable-sales-funnel-mastery/
"Selling Skills: Complete Sales Mastery Course!
<strong>Sales</strong> Training On Key Selling Skills In Each Step Of The <strong>Sales</strong> Process. Close More <strong>Sales</strong> And Generate More <strong>Sales</strong> Income.Rating: 4.4 out of 5233 reviews6 total hours64 lecturesAll LevelsCurrent price: ₹499Original price: ₹2,499",https://www.udemy.com/course/selling-skills-complete-sales-mastery-course/
"Learn to Sell Anything by Grant Cardone
How to Guarantee MASSIVE Success in <strong>Sales</strong>: A complete curriculum of <strong>sales</strong> basics, techniques, and strategies.Rating: 4.4 out of 55022 reviews5.5 total hours58 lecturesAll LevelsCurrent price: ₹1,999",https://www.udemy.com/course/the-fundamentals-of-selling-by-grant-cardone/
"Sales Operations the Complete Masterclass: 20 Courses in 1
Business Fundamentals, Development, <strong>Sales</strong> Funnels and <strong>Sales</strong> Management to Advanced AI-Driven Strategies, Neuromarketing!Rating: 4.7 out of 553 reviews23.5 total hours275 lecturesAll LevelsCurrent price: ₹499Original price: ₹1,799",https://www.udemy.com/course/the-complete-sales-operations-masterclass-20-courses-in-1/
"Sales and Selling with Emotional Intelligence
Mastering <strong>Sales</strong> and Selling Skills | The Art of Persuasion with Emotional Intelligence | Enhancing Customer ExperienceRating: 4.5 out of 52112 reviews3 total hours53 lecturesIntermediateCurrent price: ₹549Original price: ₹3,299",https://www.udemy.com/course/selling-with-emotional-intelligence/
